song_title,artist,simplified_genre,clean_lyrics
Loco,Neton Vega,Other,ey cholo yo no me equivoco si monto un reggaetón ese culo lo rebotoboto ya préndela güey ya aquí traigo una de ley que lo poco que sé me lo enseñó el sensei ey cholo yo no me equivoco si monto un reggaetón ese culo lo rebotoboto ya préndela güey ya aquí traigo una de ley que lo poco que sé me lo enseñó el sensei mamacita nuevamente déjame probar un poco lе caigo de repentе yo soy el que la sofoco mi suegra no me quiso francamente yo tampoco a la doña le dijeron que andaba fumando fogo y aunque ya no somos nada pero si quiere la toco sale muy de zapatillas con su vestidito corto dicen que yo nunca cambio que traigo los ojos rojos saco coche bomba y sale el humo por el quemacoco y no y no no me digas que no si yo sé bien sé bien que te gusto y no y no no me digas que no si yo sé bien sé bien que te gusto me dijo tu amiga que tienes el cora roto desde que ando libre me la paso bien loco melday no necesito tus polvo me prestaron otros y otra vez ando bien coco me dijo tu amiga que tienes el cora roto desde que ando libre me la paso bien loco melday no necesito tus polvo me prestaron otros y otra vez ando bien coco si me llamas ya sabes que te robo como siempre ya sabe que estoy solo si me llama ya sabes que te robo como siempre ya sabe que estoy solo me dijo tu amiga que tienes el cora roto desde que ando libre me la paso bien loco melday no necesito tus polvo me prestaron otros y otra vez ando bien coco me dijo tu amiga que tienes el cora roto desde que ando libre me la paso bien loco melday no necesito tus polvo me prestaron otros y otra vez ando bien coco si me llamas ya sabes que te robo como siempre ya sabe que estoy solo si me llama ya sabes que te robo como siempre ya sabe que estoy solo ya sabes que estoy solo me dijo tu amiga que tienes el cora roto desde que ando libre me la paso bien loco melday no necesito tus polvo me prestaron otros y otra vez ando bien coco polvo me prestaron otros y otra vez ando bien coco
Texas,Blake Shelton,Country,she cut me loose and caught herself a somewhere wind i havent heard a word and havent seen her since she disappeared quicker than this double shot of jim cause everybody at the bar started askin hows your girl she aint my girl where she been i aint quite sure good question no tellin but im bettin shes probably in texas amarillo all i know george strait said it yeah thats where all them exes go if she aint with me out here in tennessee then i dont know where shes headed if im guessin i reckon shes probably in texas shes probably in texas she might be down in georgia at her mamas for the week could be carolina california somethings tellin me shes somewhere in the lone star state with all the rest yeah that one king song knows best shes probably in texas amarillo all i know george strait said it yeah thats where all them exes go if she aint with me out here in tennessee then i dont know where shes headed if im guessin i reckon shes probably in texas shes probably in texas hows your girl she aint my girl where she been i aint quite sure good question no tellin but im bettin shes probably in texas amarillo all i know george strait said it yeah thats where all them exes go if she aint with me out here in tennessee then i dont know where shes headed if im guessin i reckon shes probably in texas shes probably in texas shes probably in texas shes probably in texas
Happen To Me,Russell Dickerson,Country,i dont know who broke up with who but shes in here chasin tequila with high noon dont know how long shes been movin on maybe five weeks or five minutes but it cant be too long and we did that whats your name thing where you from and whats your favorite drink she said shut up come and dance with me and now shes singin girls just wanna have fun at the top of her lungs dont even know shes bout to wreck someone and boys im in trouble now aint even tryna get out so come on baby take me down down down yeah dont know what happened tonight dont know what happened last week dont know what happеned to her but shes bout to happеn to me happen to me she bout to happen to me shell probably be the one that got away but right now im takin every second i can take so we keep talkin and we keep drinkin oh and i keep on fallin and she keeps on singin girls just wanna have fun at the top of her lungs dont even know shes bout to wreck someone and boys im in trouble now aint even tryna get out so come on baby take me down down down yeah dont know what happened tonight dont know what happened last week dont know what happened to her but shes bout to happen to me oh we keep on talkin and we keep on drinkin and i keep on fallin she keeps on singin girls mmm girls mmmmmm oh girls just wanna have fun at the top of her lungs dont even know shes bout to wreck someone wreck someone and boys im in trouble now aint even tryna get out so come on baby take me down down down yeah dont know what happened tonight dont know what happened last week dont know what happened to her but shes bout to happen to me she bout to happen mmm she bout to happen yeah she bout to she bout to she bout to
Your Way's Better,Forrest Frank,Christian,when i’m overwhelmed within from the weight of all my sin i need a friend to call my own i need a house to call my home when i’m broken down inside and there’s nowhere else to hide i need a place where i feel known can someone help me then i hear your reply bringing teardrops to my eyes saying i’m not alone oh lord i need you now more than ever would you put my heart back together i searched the world till my hеad hurt just to find out your way’s better ohoh your ways bettеr ohoh your ways better oh lord your ways better jesus your ways better lord i am so thankful for the ways that you blessed me everything you say making waves like a jetski you love every part of me even when i was messy now i see the heart in your beauty so i can finally sing jehovahjireh provider your way always gets me higher even on my darkest days you’re a lighter my messiah oh lord i need you now more than ever would you put my heart back together i searched the world till my head hurt just to find out your way’s better ohoh your ways better ohoh your ways better oh lord your ways better jesus mmm lord i need you now more than ever would you put my heart back together i searched the world till my head hurt just to find out your way’s better ohoh your ways better ohoh your ways better oh lord your way’s better jesus your ways better ohhohh your ways better ohhohh your ways better ohhohh your ways better jesus your ways better it’s better better better it’s better better better it’s better better better it’s better than the rest
Backseat Driver,Kane Brown,Pop,730 in the morning in a mickey ds drivethru two muffins one coffee and a little bitty orange juice i saw a man with a sign on the corner i rolled my window down handed him a dollar thats when i heard her ask hey daddy who was that and before i could answer back she said daddy look theres a plane in the sky are we there yet did you just see that dog run by do squirrels have houses in the trees whyd god put stingers on honeybees its crazy all the things she sees on the side of the road out of that window beside her i wish i could be more like her my little dangling feet pretty in pink backseat driver later on that day on the highway back home i saw a lady in a black mercedes yelling at her phone she flew by me with her finger in the air and i had to act like i didnt care and thats when i heard her ask daddy why was she so mad before i could answer back she said daddy can you please turn up the radio hey what are you pushing with your feet that makes us go do squirrels have houses in the trees whyd god put stingers on honeybees its crazy all the things she sees on the side of the road out of that window beside her i wish i could be more like her my little dangling feet pretty in pink backseat driver one day ill look back and ill miss when my whole world wasnt over that dash it was back there buckled in saying daddy look theres a plane in the sky are we there yet did you just see that dog run by do squirrels have houses in the trees why would god put a stinger on a honeybee its crazy all the things she sees on the side of the road out of that window beside her i wish i could be more like her my little dangling feet pretty in pink backseat driver hmm my backseat driver 730 in the morning in a mickey ds drivethru two muffins one coffee and a little bitty orange juice
Busy Woman,Sabrina Carpenter,Pop,oh hey oh im so mature collected and sensible except when i get hit with rejection to turn me down well thats just unethical ill turn into someone youre scared to know but if you need my love my clothes are off im comin over to your place and if you dont need if you dont need my love well i didnt want your little bitchass anyway yeah im a busy woman i wouldnt let you come into my calendar any night but if you want my kisses ill be your perfect mrs til the day that one of us dies oh hey busy woman all the time busy woman so much to shave and lipstick to reapply maybe for you though i could accommodate im flexible so just tell me what you like tantric yoga baby namaste if you dont want me ill just deem you gay but if you need my love my clothes are off im comin over to your place ah and if you dont need if you dont need my love well i didnt want your little bitchass anyway yeah im a busy woman i wouldnt let you come into my calendar any night but if you want my kisses ill be your perfect mrs til the day that one of us dies busy woman all the time busy woman for the rest of my life my openings are super tight busy woman unless you call tonight night ooh ooh but if you need my love my clothes are off im comin over to your place ah and if you dont need if you dont need my love my love well i didnt want your little bitchass anyway cause im a busy woman oh hey i wouldnt let you come into my calendar any night but if you want my kisses ill be your perfect mrs til the day that one of us dies
Are You Even Real,Teddy Swims & GIVEON,Pop,are you even real or did i make you up how could someone like you wanna give me love dont think i deserve you but i cant get enough youre so beautiful spiritual more like a miracle part of mes scared that you might be invisible oh too good to be true tell me are you are you are you are you made up in my head or are you in my bedroom questions that i ask ever since i met you hmhmhm tеll me are you are you arе you are you are you are you somethin from a dream or somethin that i made up questions that i ask every time that i wake up oh you never do too much oh somehow youre still enough for me i can feel the rush even when you slowdance for me lookin at you layin right there are you from this world i swear youre beautiful spiritual oh i just want you to know is it all pretend or somethin i made real i dont know what to think dont know dont know dont know and if its all a dream i dont wanna wake up are you are you are you are you are you made up in my head or are you in my bedroom in my bedroom questions that i ask ever since i met you ah tell me are you are you are you are you are you are you are you somethin from a dream or somethin that i made up questions that i ask every time that i wake up are you
Ojos Tristes,"Selena Gomez, benny blanco & The Marias",Pop,no its not hard to see that you probably feel worse than me its not your fault i have to leave please dont you look that way baby those sad eyes sad eyes you know i dont wanna say goodbye dont cry dont cry just hold me for one last time el muchacho de los ojos tristes vive solo y necesita amor como el aire necesita verme como al sol lo necesito yo el muchacho de los ojos tristes that boy is sad ha encontrado al fin una razón i wanna hold him para hacer que su mirada ría and seize the night con mis besos y mi gran amor han pasado dos años te sigo pensando en todos mis sentidos antes eran tus ojos lloviendo en otoño y ahora son los míos cómo cambió amor felices éramos los dos y ahora lloro por dios tristeza en mí amaneció el muchacho de los ojos tristes vive solo y necesita amor como el aire necesita verme como al sol lo necesito yo el muchacho de los ojos tristes that boy is sad ha encontrado al fin una razón i wanna hold him para hacer que su mirada ría and seize the night con mis besos y mi gran amor ladadada dada dada dada ladadada dada dada dada ladadada dada dada dada ladadada dada dada dada
EOO,Bad Bunny,Hip-Hop,ella viene por ahí y nunca llega sola sosososo— ella nunca llega sola to los bandibandido le sueltan las pistola papapapa— esta es noche lo que hayhayhayhayhay dice perreo baby sobeteo baby tratra baby hasta abajo baby en la disco baby yo te cojo baby tratra baby tratra baby perreo baby sobeteo baby tratra baby hasta abajo baby en la disco baby yo te cojo baby ey tratra baby ey tratra baby yo se la mamo y se pone contenta está wheeleá y ya cumplió los 30 después de las 12 no los cuenta no la llame en el jangueo si no quiere que mienta tás escuchando al número uno en venta por eso con nosotro nadiе inventa me siento como un bichotе en los 90 lo tengo parao ven pa que lo sienta dale mami pégate ¡ah vírate si me mira mucho sabe que voy a besarte dale mami pégate ¡ah vírate si te beso y me lo agarra entonce voa llevarte mira puñeta no me quiten el pepepepepepepe— mami yo sé que tú te vuelve loca cuando el perreo te azota pero obligao tú te acuerda de mí si me ve por ahí mami yo sé que tú te vuelve loca cuando el perreo te azota pero obligao tú te acuerda de mí de cuando te di perreo baby tratra baby en la disco baby vamo a darle baby hasta abajo baby no te quite baby bellaqueo baby tú y yo solos baby perreo baby tratra baby en la disco baby te lo meto baby aquí mismo baby delante de tu baby te compro la bm y también el ap ey te doy deo bailando mami estoy testing dale ey tráete a tu bestie uh que a la do le bajamo el panty tra tiene a 20 en lista e waiting dale te lo tiro en la espalda body painting ¡oh rompiendo la calle desde los twenty anda cazando no está dating rompe la calle siempre que sale mami tú tá fit voa lamberte lo abdominale rompe la calle siempre que sale me gusta porque tú y yo somo iguale siempre queremo perreo eo tú y yo tamo envuelto en el bellaqueo cuando nos ponen perreo eo ey no me ronquen cabrone que acá no lo veo tás escuchando música de puerto rico cabrón nosotro nos criamo escuchando y cantando esto en los caserío en los barrio desde los 90 hasta el 2000 por siempre y ando con el mejor de to los tiempo tainy y yo no tengo que roncar ustedes saben ya yeahyeahyeahyeah yeahyeahyeahyeah bad bunny baby bad bunny baby eh tainy tainy tainy tainy chequéate la historia
Steve's Lava Chicken,Jack Black,Rock,“steve’s lava chicken” is the seventh track on a minecraft movie’s soundtrack the song is sung by jack black in a minecraft movie when steve played by jack black shows to the other… read more lalalalava chchchchicken steves lava chicken yeah its tasty as hell ooh mamacita now youre ringin the bell crispy and juicy now youre havin a snack ooh super spicy its a lava attack
The Largest,BigXthaPlug,Hip-Hop,tony coles ayy let the band play safe to say im the biggest the largest been steppin on shit since my mama stayed in them apartments regardless my daddy told me keep the heat even when im in foreigns im heartless cause these niggas is hatin on me just because im the biggest the largest the biggest the largest 30k on my wrist just for hard times these niggas just mad cause thеy bitch in my archives jordan came back throw the 45 if you play thеn you lay right there by yo own kind pour up a four in a loko tell em run this bitch back like soso got rap shit here in a chokehold did a show out in austin shoutout to bobo moved out the trenches now look how we live told my bm to furnish the crib walk out the mall with some shoes for the kids deposit a check shit my bank full of ms paid up my rent now im up for the year the view look crazy from here what i paid for some dogs couldve bought me veneers texas piece on my neck couldve bought your career safe to say im the biggest the largest been steppin on shit since my mama stayed in them apartments regardless my daddy told me keep the heat even when im in foreigns im heartless cause these niggas is hatin on me just because im the biggest the largest the biggest the largest ayy stuffin cali plug weed in the blunt let my lil brother roll him a dutch my lil boy get whatever he want madam t dont be askin for much pourin lean on the nuggets of runtz spill the rest of that drank in a punch left wrist on some i had to stunt right wrist i just did it because 600 the label you know we comin tell them niggas they aint takin nothin standin on business we shootin or punchin hatinass nigga go get you some money i just got off a tour finna go on another one album done finna drop me another one couple of ms finna run up another one super bowl rings shit i had to go double em safe to say im the biggest the largest been steppin on shit since my mama stayed in them apartments regardless my daddy told me keep the heat even when im in foreigns im heartless cause these niggas is hatin on me just because im the biggest the largest the biggest the largest ayy
No Pole,Don Toliver,Hip-Hop,yeah uhuh uhuh uhuh yeahyeah yeahyeah uhuh yeah she dont wanna strip no more dont wanna hit that pole oh hit my old plug i get it in and go ooh ooh shawty owe me something better pay your toll pay up pay up i lick the spoon and i scrape the bowl skrrt skrrt scrape the bowl skrrt skrrt scrape the bowl skrrt skrrt like did you get the memo she eat at out of the relay im poppin hella skittles then i can solve your riddle well smoke you like its menthol this dude is crazy mental a suave hood hеro got johnny dang dental shes a nympho she slobbin on hеr pillow got chicken rob de niro shes too gone and she cant hear you ooh ooh i know she dont wanna strip no more dont wanna hit that pole hit my old plug i get it in and go she dont wanna strip no more dont wanna hit that pole oh hit my old plug i get it in and go ooh ooh shawty owe me something better pay your toll pay up pay up i lick the spoon and i scrape the bowl skrrt skrrt scrape the bowl skrrt skrrt scrape the bowl skrrt skrrt seein way too many ones im bout to throw some hundreds im bout to throw some hundreds in that old life that you run from baby girl keep running ooh keep running its pressure with me sexually sexually check my bank account ooh ooh its precious to me i got my anchor out ooh ooh im locked in your sea you know youre my baby now youre special to me i bought you time i bought you diamonds you can keep the receipt i got you down i got you loose i guess you owe it to me is you down or nah fuck around find your spot i get you lit lit drunk trip watch me slip inside she dont wanna strip no more dont wanna hit that pole oh hit my old plug i get it in and go ooh ooh shawty owe me something better pay your toll pay up pay up i lick the spoon and i scrape the bowl skrrt skrrt scrape the bowl skrrt skrrt scrape the bowl skrrt skrrt and i sent her away pull out sent her on her way she dont wanna hit the strip club no no she dont wanna go strip no no she dont wanna go strip no way
Feel It,d4vd,Alternative,what do you have in store one life away we cant explore but i dont want to get in the way no more cause this the type of feeling you cant ignore ayy im ready to break down the door settle the score i cant let you go away i miss the smile on your face you know that i lolololove the chase you told me once that i was crazy i said baby girl i know but i cant let you go away so dont you get me started now i want a yes i dont want maybes cause they leave me where you found me so dont leave ooh i just love the way youve got me feeling in love with the feeling its like ooh take away the pain baby im healing baby im healing i dont need anything more be the wave ill be the shore crashing all over me i want you fire what do you have in store type of girl that make me drop dead on the floor this the only girl that i love and adore this the type of love that you cant ignore i said hey she coming my way she running round saying whatever she wanna say i told her i dont wanna have to do this everyday told her that i love her but she thinking its a game oh no now she uncomfortable never wanna make her feel onedimensional oh yeahoh nahnahnah dont know how we got there dont you get me started now you told me once that i was crazy i said baby girl i know but i cant let you go away so dont you get me started now i want a yes i dont want maybes cause they leave me where you found me so dont leave ooh i just love the way youve got me feeling oh you got me feeling in love with the feeling oh you got me feeling its like ooh take away the pain baby im healing baby im healing baby im healing baby im healing i dont need anything more ooh be the wave ill be the shore shooore crashing all over me i want you oh yeahahah
Die Trying,"PARTYNEXTDOOR, Drake & Yebba",R&B,yeah girl i cant decide if i should stay and say i tried or i should leave and say goodbye its killin me inside if i could just get next to you id probably be alright but were so busy in this life we always say some other time why wont my tears work its been a decade since ive cried i got no dog left in the fight the bark dont match the bite me and my old man we just get fucked up every night he said son these hoes just dont love you i said ill keep that in mind those aint words to live by wouldnt call that sound advice our future doesnt sound too bright but i just nod and say youre right i do girl i cant decide if i should stay and say i tried or i should leave and say goodbye its killin me inside and all my my presents to show my affection flowers and diamonds and jets through the sky im not here to teach you a lesson no im just a caring and passionate guy talks with your friends got you changin your vibe talks with your friends got you changin talks with your friends got you changin your vibe talking to your friends girl i miss my friends you know too much of them have died i wish that they were still alive just to see the silver lines this year me and god we wasnt seein eye to eye i prayed to her from time to time she was busy on another vibe i cant vent to you through no text message and reply i need to see you face to face gotta look you in the eye i do girl i cant decide if i should stay and say i tried or i should leave and say goodbye its killin me inside and all my presents to show my affection flowers and diamonds and jets through the sky im not here to teach you a lesson no no im just a caring and passionate guy talks with your friends got you changin your vibe talks with your friends got you changin talks with your friends got you changin your vibe talking to your friends ooh another misunderstanding of course i pushed you away cause thats what i could afford ooh we felt way too true and it hurts so laughing or crying will only make it worse
Like Him,"Tyler, The Creator Featuring Lola Young",Hip-Hop,damn nigga every time i look at you i swear to god nigga you got that nigga feet you got that nigga body you got that nigga long arms fingers and shit flat feet big di— she said that i make expressions like him my legs to my shoulders and my chin like him my waist and my posture like him like him like him like him like him mama im chasin a ghost i dont know who he is mama im chasin a ghost i dont know where he is mama im chasin a ghost do i look like him like what like him like what like him like what like him lalalala lalalala you gave me love and affection attention go protection how could i ever miss somethin go that id never had i would nevеr judge ya cause evеrything worked out without him like what like him like what like him huh mama im chasin a ghost i dont know who he is mama im chasin a ghost i dont know where he is mama im chasin a ghost do i look huh like him like him i decided to anything that lives inside of you i would never ever lie to you yeah you aint ever gotta lie to me im everything that ive strived to be so do i look like him do i look like him like him like him like him like him i dont look like him like him it was my fault not yours not his it was my fault im sorry you know it was my fault not him cause he always wanted to be there for you and im sorry i was young but hes always wanted to be a father to you so i i fucked up and i take ownership of that of my choices and decisions and im sorry for that hes a good guy so dont hold that against him because it was my fault just you know forgive me
Morena,Neton Vega & Peso Pluma,Other,¡uhah ahorita ando como quiero con los balenciaga y un polvito bueno pa empezar la fiesta que nos amanezca clase azul el tequilita no me pide nada no me pide nada y eso me apendeja me apendeja cama y láser la nariz helada yo te cumplo mija todo todo lo que quieras tás bien buena piratita por un lado la plebita la falda cortita chula la morena tá bien buena así suena el neto y la puta doble p mija ¡uh dos esclava en la muñeca los ojos tumbados por el humo blanco y el escapulario aquí lo traigo a diario pérdidas las tres llamadas no sé dónde estaba traía el cel sin carga ella no me cree nada ella no me cree nada cama y láser la nariz helada yo te cumplo mija todo todo lo que quieras tás bien buena piratita por un lado la plebita la falda cortita chula la morena tá bien buena
